### ISSUE TITLE
sending nlri-mpls route with more than one label

### ISSUE THREAD

**Issue by rendoaw** [Exa-Networks/exabgp#463]
Hi Thomas, 

Can i use ExaBGP to announce route with more than one label for nlri-mpls?

The following announcement works

```
announce route 1.1.1.4/32 next-hop self label [ 11111 ]
```

but, the following announcement is rejected by the router

```
announce route 1.1.1.4/32 next-hop self label [ 11111 22222 ]
```

and the error is 

```
| INFO     | 35848  | network       | Peer    192.168.1.27 ASN 1980 out loop, peer reset, message [notification received (3,10)] error[UPDATE message error / Invalid Network Field]
```

For your reference, the following is the wireshark result. Frame 143 is captured when the announcement with single label works perfectly. 
And frame 429 is the one that fails, when i send the route with 2 labels.
Looks like there is an issue with the prefix length calculation(?)

I have seen some example that someone can send more than one label, so it is possible that i did something wrong here. I am trying on 3.4.16. 

Thank you for your help. 

Below is the tcpdump output

```

    143 03:07:27.784965    192.168.1.154         192.168.1.27          BGP      123    UPDATE Message

Frame 143: 123 bytes on wire (984 bits), 123 bytes captured (984 bits) on interface 0
    Interface id: 0 (en0)
    Encapsulation type: Ethernet (1)
    Arrival Time: Aug 14, 2016 03:07:27.784965000 EDT
    [Time shift for this packet: 0.000000000 seconds]
    Epoch Time: 1471158447.784965000 seconds
    [Time delta from previous captured frame: 0.006465000 seconds]
    [Time delta from previous displayed frame: 13.669335000 seconds]
    [Time since reference or first frame: 19.610734000 seconds]
    Frame Number: 143
    Frame Length: 123 bytes (984 bits)
    Capture Length: 123 bytes (984 bits)
    [Frame is marked: False]
    [Frame is ignored: False]
    [Protocols in frame: eth:ethertype:ip:tcp:bgp]
    [Coloring Rule Name: Routing]
    [Coloring Rule String: hsrp || eigrp || ospf || bgp || cdp || vrrp || carp || gvrp || igmp || ismp]
Ethernet II, Src: Apple_a0:3e:ce (c8:69:cd:a0:3e:ce), Dst: RealtekU_61:b8:12 (52:54:00:61:b8:12)
    Destination: RealtekU_61:b8:12 (52:54:00:61:b8:12)
        Address: RealtekU_61:b8:12 (52:54:00:61:b8:12)
        .... ..1. .... .... .... .... = LG bit: Locally administered address (this is NOT the factory default)
        .... ...0 .... .... .... .... = IG bit: Individual address (unicast)
    Source: Apple_a0:3e:ce (c8:69:cd:a0:3e:ce)
        Address: Apple_a0:3e:ce (c8:69:cd:a0:3e:ce)
        .... ..0. .... .... .... .... = LG bit: Globally unique address (factory default)
        .... ...0 .... .... .... .... = IG bit: Individual address (unicast)
    Type: IPv4 (0x0800)
Internet Protocol Version 4, Src: 192.168.1.154, Dst: 192.168.1.27
    0100 .... = Version: 4
    .... 0101 = Header Length: 20 bytes
    Differentiated Services Field: 0x00 (DSCP: CS0, ECN: Not-ECT)
        0000 00.. = Differentiated Services Codepoint: Default (0)
        .... ..00 = Explicit Congestion Notification: Not ECN-Capable Transport (0)
    Total Length: 109
    Identification: 0x368e (13966)
    Flags: 0x02 (Don't Fragment)
        0... .... = Reserved bit: Not set
        .1.. .... = Don't fragment: Set
        ..0. .... = More fragments: Not set
    Fragment offset: 0
    Time to live: 64
    Protocol: TCP (6)
    Header checksum: 0x7ff7 [validation disabled]
        [Good: False]
        [Bad: False]
    Source: 192.168.1.154
    Destination: 192.168.1.27
    [Source GeoIP: Unknown]
    [Destination GeoIP: Unknown]
Transmission Control Protocol, Src Port: 50390 (50390), Dst Port: 179 (179), Seq: 3703712318, Ack: 2998224239, Len: 57
    Source Port: 50390
    Destination Port: 179
    [Stream index: 0]
    [TCP Segment Len: 57]
    Sequence number: 3703712318
    [Next sequence number: 3703712375]
    Acknowledgment number: 2998224239
    Header Length: 32 bytes
    Flags: 0x018 (PSH, ACK)
        000. .... .... = Reserved: Not set
        ...0 .... .... = Nonce: Not set
        .... 0... .... = Congestion Window Reduced (CWR): Not set
        .... .0.. .... = ECN-Echo: Not set
        .... ..0. .... = Urgent: Not set
        .... ...1 .... = Acknowledgment: Set
        .... .... 1... = Push: Set
        .... .... .0.. = Reset: Not set
        .... .... ..0. = Syn: Not set
        .... .... ...0 = Fin: Not set
        [TCP Flags: *******AP***]
    Window size value: 4098
    [Calculated window size: 131136]
    [Window size scaling factor: 32]
    Checksum: 0xd5f4 [validation disabled]
        [Good Checksum: False]
        [Bad Checksum: False]
    Urgent pointer: 0
    Options: (12 bytes), No-Operation (NOP), No-Operation (NOP), Timestamps
        No-Operation (NOP)
            Type: 1
                0... .... = Copy on fragmentation: No
                .00. .... = Class: Control (0)
                ...0 0001 = Number: No-Operation (NOP) (1)
        No-Operation (NOP)
            Type: 1
                0... .... = Copy on fragmentation: No
                .00. .... = Class: Control (0)
                ...0 0001 = Number: No-Operation (NOP) (1)
        Timestamps: TSval 1571065666, TSecr 1356033
            Kind: Time Stamp Option (8)
            Length: 10
            Timestamp value: 1571065666
            Timestamp echo reply: 1356033
    [SEQ/ACK analysis]
        [iRTT: 0.015387000 seconds]
        [Bytes in flight: 57]
Border Gateway Protocol - UPDATE Message
    Marker: ffffffffffffffffffffffffffffffff
    Length: 57
    Type: UPDATE Message (2)
    Withdrawn Routes Length: 0
    Total Path Attribute Length: 34
    Path attributes
        Path Attribute - ORIGIN: IGP
            Flags: 0x40, Transitive: Well-known, Transitive, Complete
                0... .... = Optional: Well-known
                .1.. .... = Transitive: Transitive
                ..0. .... = Partial: Complete
                ...0 .... = Length: Regular length
            Type Code: ORIGIN (1)
            Length: 1
            Origin: IGP (0)
        Path Attribute - AS_PATH: empty
            Flags: 0x40, Transitive: Well-known, Transitive, Complete
                0... .... = Optional: Well-known
                .1.. .... = Transitive: Transitive
                ..0. .... = Partial: Complete
                ...0 .... = Length: Regular length
            Type Code: AS_PATH (2)
            Length: 0
        Path Attribute - LOCAL_PREF: 100
            Flags: 0x40, Transitive: Well-known, Transitive, Complete
                0... .... = Optional: Well-known
                .1.. .... = Transitive: Transitive
                ..0. .... = Partial: Complete
                ...0 .... = Length: Regular length
            Type Code: LOCAL_PREF (5)
            Length: 4
            Local preference: 100
        Path Attribute - MP_REACH_NLRI
            Flags: 0x80, Optional: Optional, Non-transitive, Complete
                1... .... = Optional: Optional
                .0.. .... = Transitive: Non-transitive
                ..0. .... = Partial: Complete
                ...0 .... = Length: Regular length
            Type Code: MP_REACH_NLRI (14)
            Length: 17
            Address family identifier (AFI): IPv4 (1)
            Subsequent address family identifier (SAFI): Labeled Unicast (4)
            Next hop network address (4 bytes)
                Next Hop: 192.168.1.154
            Number of Subnetwork points of attachment (SNPA): 0
            Network layer reachability information (8 bytes)
                Label Stack=16 (bottom) IPv4=1.1.1.3/32
                    MP Reach NLRI Prefix length: 56
                    MP Reach NLRI Label Stack: 16 (bottom)
                    MP Reach NLRI IPv4 prefix: 1.1.1.3

0000  52 54 00 61 b8 12 c8 69 cd a0 3e ce 08 00 45 00   RT.a...i..>...E.
0010  00 6d 36 8e 40 00 40 06 7f f7 c0 a8 01 9a c0 a8   .m6.@.@.........
0020  01 1b c4 d6 00 b3 dc c2 2a 3e b2 b5 45 6f 80 18   ........*>..Eo..
0030  10 02 d5 f4 00 00 01 01 08 0a 5d a4 8f 42 00 14   ..........]..B..
0040  b1 01 ff ff ff ff ff ff ff ff ff ff ff ff ff ff   ................
0050  ff ff 00 39 02 00 00 00 22 40 01 01 00 40 02 00   ...9...."@...@..
0060  40 05 04 00 00 00 64 80 0e 11 00 01 04 04 c0 a8   @.....d.........
0070  01 9a 00 38 00 01 01 01 01 01 03                  ...8.......












    429 03:07:51.826632    192.168.1.154         192.168.1.27          BGP      126    UPDATE Message

Frame 429: 126 bytes on wire (1008 bits), 126 bytes captured (1008 bits) on interface 0
    Interface id: 0 (en0)
    Encapsulation type: Ethernet (1)
    Arrival Time: Aug 14, 2016 03:07:51.826632000 EDT
    [Time shift for this packet: 0.000000000 seconds]
    Epoch Time: 1471158471.826632000 seconds
    [Time delta from previous captured frame: 0.029216000 seconds]
    [Time delta from previous displayed frame: 24.041667000 seconds]
    [Time since reference or first frame: 43.652401000 seconds]
    Frame Number: 429
    Frame Length: 126 bytes (1008 bits)
    Capture Length: 126 bytes (1008 bits)
    [Frame is marked: False]
    [Frame is ignored: False]
    [Protocols in frame: eth:ethertype:ip:tcp:bgp]
    [Coloring Rule Name: Routing]
    [Coloring Rule String: hsrp || eigrp || ospf || bgp || cdp || vrrp || carp || gvrp || igmp || ismp]
Ethernet II, Src: Apple_a0:3e:ce (c8:69:cd:a0:3e:ce), Dst: RealtekU_61:b8:12 (52:54:00:61:b8:12)
    Destination: RealtekU_61:b8:12 (52:54:00:61:b8:12)
        Address: RealtekU_61:b8:12 (52:54:00:61:b8:12)
        .... ..1. .... .... .... .... = LG bit: Locally administered address (this is NOT the factory default)
        .... ...0 .... .... .... .... = IG bit: Individual address (unicast)
    Source: Apple_a0:3e:ce (c8:69:cd:a0:3e:ce)
        Address: Apple_a0:3e:ce (c8:69:cd:a0:3e:ce)
        .... ..0. .... .... .... .... = LG bit: Globally unique address (factory default)
        .... ...0 .... .... .... .... = IG bit: Individual address (unicast)
    Type: IPv4 (0x0800)
Internet Protocol Version 4, Src: 192.168.1.154, Dst: 192.168.1.27
    0100 .... = Version: 4
    .... 0101 = Header Length: 20 bytes
    Differentiated Services Field: 0x00 (DSCP: CS0, ECN: Not-ECT)
        0000 00.. = Differentiated Services Codepoint: Default (0)
        .... ..00 = Explicit Congestion Notification: Not ECN-Capable Transport (0)
    Total Length: 112
    Identification: 0xe207 (57863)
    Flags: 0x02 (Don't Fragment)
        0... .... = Reserved bit: Not set
        .1.. .... = Don't fragment: Set
        ..0. .... = More fragments: Not set
    Fragment offset: 0
    Time to live: 64
    Protocol: TCP (6)
    Header checksum: 0xd47a [validation disabled]
        [Good: False]
        [Bad: False]
    Source: 192.168.1.154
    Destination: 192.168.1.27
    [Source GeoIP: Unknown]
    [Destination GeoIP: Unknown]
Transmission Control Protocol, Src Port: 50390 (50390), Dst Port: 179 (179), Seq: 3703712394, Ack: 2998224258, Len: 60
    Source Port: 50390
    Destination Port: 179
    [Stream index: 0]
    [TCP Segment Len: 60]
    Sequence number: 3703712394
    [Next sequence number: 3703712454]
    Acknowledgment number: 2998224258
    Header Length: 32 bytes
    Flags: 0x018 (PSH, ACK)
        000. .... .... = Reserved: Not set
        ...0 .... .... = Nonce: Not set
        .... 0... .... = Congestion Window Reduced (CWR): Not set
        .... .0.. .... = ECN-Echo: Not set
        .... ..0. .... = Urgent: Not set
        .... ...1 .... = Acknowledgment: Set
        .... .... 1... = Push: Set
        .... .... .0.. = Reset: Not set
        .... .... ..0. = Syn: Not set
        .... .... ...0 = Fin: Not set
        [TCP Flags: *******AP***]
    Window size value: 4097
    [Calculated window size: 131104]
    [Window size scaling factor: 32]
    Checksum: 0x05a4 [validation disabled]
        [Good Checksum: False]
        [Bad Checksum: False]
    Urgent pointer: 0
    Options: (12 bytes), No-Operation (NOP), No-Operation (NOP), Timestamps
        No-Operation (NOP)
            Type: 1
                0... .... = Copy on fragmentation: No
                .00. .... = Class: Control (0)
                ...0 0001 = Number: No-Operation (NOP) (1)
        No-Operation (NOP)
            Type: 1
                0... .... = Copy on fragmentation: No
                .00. .... = Class: Control (0)
                ...0 0001 = Number: No-Operation (NOP) (1)
        Timestamps: TSval 1571089630, TSecr 1384994
            Kind: Time Stamp Option (8)
            Length: 10
            Timestamp value: 1571089630
            Timestamp echo reply: 1384994
    [SEQ/ACK analysis]
        [iRTT: 0.015387000 seconds]
        [Bytes in flight: 60]
Border Gateway Protocol - UPDATE Message
    Marker: ffffffffffffffffffffffffffffffff
    Length: 60
    Type: UPDATE Message (2)
    Withdrawn Routes Length: 0
    Total Path Attribute Length: 37
    Path attributes
        Path Attribute - ORIGIN: IGP
            Flags: 0x40, Transitive: Well-known, Transitive, Complete
                0... .... = Optional: Well-known
                .1.. .... = Transitive: Transitive
                ..0. .... = Partial: Complete
                ...0 .... = Length: Regular length
            Type Code: ORIGIN (1)
            Length: 1
            Origin: IGP (0)
        Path Attribute - AS_PATH: empty
            Flags: 0x40, Transitive: Well-known, Transitive, Complete
                0... .... = Optional: Well-known
                .1.. .... = Transitive: Transitive
                ..0. .... = Partial: Complete
                ...0 .... = Length: Regular length
            Type Code: AS_PATH (2)
            Length: 0
        Path Attribute - LOCAL_PREF: 100
            Flags: 0x40, Transitive: Well-known, Transitive, Complete
                0... .... = Optional: Well-known
                .1.. .... = Transitive: Transitive
                ..0. .... = Partial: Complete
                ...0 .... = Length: Regular length
            Type Code: LOCAL_PREF (5)
            Length: 4
            Local preference: 100
        Path Attribute - MP_REACH_NLRI
            Flags: 0x80, Optional: Optional, Non-transitive, Complete
                1... .... = Optional: Optional
                .0.. .... = Transitive: Non-transitive
                ..0. .... = Partial: Complete
                ...0 .... = Length: Regular length
            Type Code: MP_REACH_NLRI (14)
            Length: 20
            Address family identifier (AFI): IPv4 (1)
            Subsequent address family identifier (SAFI): Labeled Unicast (4)
            Next hop network address (4 bytes)
                Next Hop: 192.168.1.154
            Number of Subnetwork points of attachment (SNPA): 0
            Network layer reachability information (11 bytes)
                MP Reach NLRI Labeled IPv4 prefix length 80 invalid
                    [Expert Info (Error/Malformed): MP Reach NLRI Labeled IPv4 prefix length 80 invalid]
                        [MP Reach NLRI Labeled IPv4 prefix length 80 invalid]
                        [Severity level: Error]
                        [Group: Malformed]

0000  52 54 00 61 b8 12 c8 69 cd a0 3e ce 08 00 45 00   RT.a...i..>...E.
0010  00 70 e2 07 40 00 40 06 d4 7a c0 a8 01 9a c0 a8   .p..@.@..z......
0020  01 1b c4 d6 00 b3 dc c2 2a 8a b2 b5 45 82 80 18   ........*...E...
0030  10 01 05 a4 00 00 01 01 08 0a 5d a4 ec de 00 15   ..........].....
0040  22 22 ff ff ff ff ff ff ff ff ff ff ff ff ff ff   ""..............
0050  ff ff 00 3c 02 00 00 00 25 40 01 01 00 40 02 00   ...<....%@...@..
0060  40 05 04 00 00 00 64 80 0e 14 00 01 04 04 c0 a8   @.....d.........
0070  01 9a 00 50 00 01 00 00 01 11 01 01 01 04         ...P..........

```

Here is the config file

```
$ cat exabgp.conf.ebgp
group peer {
    capability {
         route-refresh;
    }
    hold-time 180;
    #local-as 64900;
    #peer-as 64900;
    local-as 2011;
    peer-as 1980;
    router-id 192.168.1.154;
    graceful-restart 1200;
    adj-rib-out true;
    #process dump_to_file {
    #  run ./etc/exabgp/processes/syslog-1.py;
    #  encoder json;
    #  receive {
    #    parsed;
    #    update;
    #    neighbor-changes;
    #  }
    #}
    process adv_routes {
        run /usr/bin/python /Users/rendo/02-MySVN/github/exabgp34-bgpls/http_api.py;
        receive {
            parsed;
            update;
            neighbor-changes;
            packets;
        }
        send {
            packets;
        }
    }
    #neighbor 192.168.1.29 {
    #    local-address 192.168.1.154;
    #}
    neighbor 192.168.1.27 {
        local-address 192.168.1.154;
        group-updates false;
        family {
                ipv4 nlri-mpls;
        }
    }
}
```

**Comment by russellkelly** [comment]
Seems like the receiving platform does not understand the nlri update >10bytes.  Is it capable of receiving >1 label?  What is the receiving platform and configuration?

**Comment by rendoaw** [comment]
Hi Russ, thanks for the pointer. 
Yes, the issue was on the receiving side. I change the receiver and it works although wireshark decoder still complaint about it.

I am closing this issue, thanks.

**Comment by thomas-mangin** [comment]
thank you @russellkelly
