### ISSUE TITLE
md5-password invalid in master

### ISSUE THREAD

**Issue by pubyun** [Exa-Networks/exabgp#680]
exabgp can not establish neighbor with router, version master.
tcpdump shows md5invalid.

same config works with version 62eb0d4.

$ sudo tcpdump -ni eth0 -M ZfZcT8MXk tcp port 179
tcpdump: verbose output suppressed, use -v or -vv for full protocol decode
22:36:29.451822 IP 118.184.176.9.12681 > 61.160.239.2.bgp: Flags [S], seq 1974498932, win 29200, options [nop,nop,md5invalid,mss 1460,nop,nop,sackOK,nop,wscale 9], length 0
22:36:29.452167 IP 118.184.176.9.26746 > 61.160.239.1.bgp: Flags [S], seq 966077813, win 29200, options [nop,nop,md5invalid,mss 1460,nop,nop,sackOK,nop,wscale 9], length 0
22:36:30.453233 IP 118.184.176.9.12681 > 61.160.239.2.bgp: Flags [S], seq 1974498932, win 29200, options [nop,nop,md5invalid,mss 1460,nop,nop,sackOK,nop,wscale 9], length 0
22:36:30.453257 IP 118.184.176.9.26746 > 61.160.239.1.bgp: Flags [S], seq 966077813, win 29200, options [nop,nop,md5invalid,mss 1460,nop,nop,sackOK,nop,wscale 9], length 0

**Comment by thomas-mangin** [comment]
Not enough information to diagnose or debug. Please re-open if this is still an issue and provide the information requested in the template please. Thank you.

**Comment by pubyun** [comment]
```
template {
    neighbor router {
        local-as 18257;
        peer-as 18257;
        group-updates false;
        hold-time 180;
        capability {
            graceful-restart 1200;
        }

        family {
            ipv4 unicast;
        }
    }
}

neighbor 61.160.240.1 {
    inherit router;
    description "wj.ne40e.1";
    router-id 118.184.176.9;
    local-address 118.184.176.9;
    md5-password ZfZcTMXl8k;
}
```

then capture the tcp packet send by exabgp with "-M" option of tcpdump:

tcpdump -ni eth0 -M ZfZcT8MXk tcp port 179

it will shows md5invalid with master version, and exabgp can not establish other router.

it works with version 62eb0d4.

**Comment by thomas-mangin** [comment]
Thank you for the extra information. You still did not provide all the information requested. I have no idea what ExaBGP version you are running, what OS it is run on, etc.

Can you also please provide me the output of `--validate` to see if the md5-option was well recorded, and if so I will try to replicate.

**Comment by pubyun** [comment]
$ sbin/exabgp /etc/exabgp/exabgp.conf  -d --validate                                                                                                                                                                                                                                                                                                                                                                      <<<
sbin/exabgp: line 40: : command not found
sbin/exabgp: line 42: exec: : not found

**Comment by thomas-mangin** [comment]
You still did not provide me what version you are using. If you are not using 4.0.2 - can you please upgrade to check if the issue still exists.

**Comment by pubyun** [comment]
[p.txt](https://github.com/Exa-Networks/exabgp/files/1152126/p.txt)

**Comment by pubyun** [comment]
i should install a python3 to get “--validate” to work.

should i also run exabgp 4.x with python 3?

**Comment by thomas-mangin** [comment]
`3.4.5` is not supported please use the latest 3.4 version (`3.4.20`). The name of the option in `3.4.20` is still `md5` (and not md5-password).

**Comment by pubyun** [comment]
3.4.5 is python version.

exabgp is master-d5e161a9b2c13dc4222b03ea0a423d6dbf676c17

17:37:40 | 699064 | welcome         | Thank you for using ExaBGP
17:37:40 | 699064 | version         | master-d5e161a9b2c13dc4222b03ea0a423d6dbf676c17
17:37:40 | 699064 | interpreter     | 3.4.5 (default, May 29 2017, 15:17:55)  [GCC 4.8.5 20150623 (Red Hat 4.8.5-11)]

**Comment by thomas-mangin** [comment]
ok - thank - sorry - misread the output - issue when you are doing too many things at once ... 
On my environment I get the lovely message 
```
connection to 61.160.239.1:179 failed, ExaBGP has no MD5 support for Darwin
```
and I have no routers with MD5 setup at hand.

@brijohn - could you help please ? or should I build a few VM and try to replicate when I have some time.

**Comment by pubyun** [comment]
you need no routers with MD5 to test.

you can test it with linux VM with "-M" option of tcpdump to validate MD5 of BGP.

**Comment by pubyun** [comment]
it works with  md5-base64  false

'''
neighbor 61.160.239.1 {
    inherit router;
    description "wj.ne40e.1";
    router-id 118.184.176.9;
    local-address 118.184.176.9;
    md5-password ZfZcTMXl8k;
    md5-base64 false;
}
'''

**Comment by pubyun** [comment]
the validate failed with md5-base64 false:

```
$ sudo sbin/exabgp  -d --validate /etc/exabgp/exabgp.conf -e /etc/exabgp/exabgp.env  > /tmp/p.txt
Traceback (most recent call last):
  File "/home/ppyy/Project/exabgp/lib/exabgp/application/bgp.py", line 422, in <module>
    main()
  File "/home/ppyy/Project/exabgp/lib/exabgp/application/bgp.py", line 300, in main
    run(env,comment,configurations,root,options["--validate"])
  File "/home/ppyy/Project/exabgp/lib/exabgp/application/bgp.py", line 366, in run
    was_ok = Reactor(configurations).run(validate,root)
  File "/home/ppyy/Project/exabgp/lib/exabgp/reactor/loop.py", line 136, in run
    if not self.load():
  File "/home/ppyy/Project/exabgp/lib/exabgp/reactor/loop.py", line 323, in load
    self.listener.listen_on(ip, neighbor.peer_address, self._port, neighbor.md5_password, neighbor.md5_base64, None)
  File "/home/ppyy/Project/exabgp/lib/exabgp/reactor/listener.py", line 100, in listen_on
    self._listen(local_addr, remote_addr, port, md5_password, md5_base64, ttl_in)
  File "/home/ppyy/Project/exabgp/lib/exabgp/reactor/listener.py", line 64, in _listen
    MD5(sock,peer_ip.top(),0,md5,md5_base64)
  File "/home/ppyy/Project/exabgp/lib/exabgp/reactor/network/tcp.py", line 164, in MD5
    key = pack('2xH4x%ds' % TCP_MD5SIG_MAXKEYLEN, len(md5), md5)
struct.error: argument for 's' must be a bytes object

```

**Comment by thomas-mangin** [comment]
Thank you for the information, I will improve the code to make the MD5 discovery status clearer and fix this bug.

**Comment by pubyun** [comment]
it still not work with commit f3715e6.

**Comment by pubyun** [comment]
the patch f3715e6 does not resolve the problem.

**Comment by thomas-mangin** [comment]
AFAICS, I resolved the issue reported with  `struct.error: argument for 's' must be a bytes object`
The MD5 code was changed by @brijohn may be he will know why it is not working. I will otherwise look into it when I can and I have little time for researching issues atm. The issue is still open so I agree it needs fixing and will be in good time.

**Comment by pubyun** [comment]
please reopen the issue
