### ISSUE TITLE
Problem with OpenBSD 4.7 OpenBGPD

### ISSUE THREAD

**Issue by thomas-mangin** [Exa-Networks/exabgp#1]
_From [manuel.guesdon@gmail.com](https://code.google.com/u/manuel.guesdon@gmail.com/) on October 27, 2010 15:42:24_

When ExaBGP (v 1.0.2) try to connect to OpenBGPD (OpenBSD v4.7) and say:
300 16:34:40  OpenBGPPeerIP/  41157 -> OPEN version=4 asn=41157 hold_time=180 router_id=ExaBGPIP capabilities=[Multiprotocol for IPv4 unicast, 4Bytes AS 41157]
300 16:34:41  OpenBGPPeerIP/  41157 Sending Notification (2,0) [OPEN message error: Unspecific.]  bad length for OPEN capability (size mismatch)
300 16:34:43  OpenBGPPeerIP/  41157 -> OPEN version=4 asn=41157 hold_time=180 router_id=ExaBGPIP capabilities=[Multiprotocol for IPv4 unicast, 4Bytes AS 41157]

Here is a tcpdump of the exchange:

16:34:40.641016 ExaBGPIP.38386 > OpenBGPPeerIP.bgp: S 1393923812:1393923812(0) win 16384 <mss 1460,nop,nop,sackOK,nop,wscale 0,nop,nop,timestamp 3190136799 0> (DF)
16:34:40.641149 OpenBGPPeerIP.bgp > ExaBGPIP.38386: S 1446886952:1446886952(0) ack 1393923813 win 16384 <mss 1460,nop,wscale 0,nop,nop,timestamp 94785184 3190136799> (DF)
16:34:40.641174 ExaBGPIP.38386 > OpenBGPPeerIP.bgp: . ack 1 win 16384 <nop,nop,timestamp 3190136799 94785184> (DF)
16:34:40.641375 ExaBGPIP.38386 > OpenBGPPeerIP.bgp: P 1:46(45) ack 1 win 16384 <nop,nop,timestamp 3190136799 94785184>: BGP (OPEN: Version 4, AS #41157, Holdtime 180, ID ExaBGPIP, Option length 16 ((CAP MULTI_PROTOCOL [IPv4 Unicast]) (CAP AS4 #41157))) (DF)
16:34:40.641392 OpenBGPPeerIP.bgp > ExaBGPIP.38386: P 1:46(45) ack 1 win 17376 <nop,nop,timestamp 94785184 0>: BGP (OPEN: Version 4, AS #41157, Holdtime 90, ID 81.201.176.8, Option length 16 ((CAP MULTI_PROTOCOL [IPv4 Unicast], CAP ROUTE_REFRESH, CAP AS4 #41157))) (DF) [tos 0xc0]
16:34:40.641533 OpenBGPPeerIP.bgp > ExaBGPIP.38386: P 46:65(19) ack 46 win 17376 <nop,nop,timestamp 94785184 0>: BGP (KEEPALIVE) (DF) [tos 0xc0]
16:34:40.641552 ExaBGPIP.38386 > OpenBGPPeerIP.bgp: . ack 65 win 16320 <nop,nop,timestamp 3190136799 94785184> (DF)
16:34:41.651166 ExaBGPIP.38386 > OpenBGPPeerIP.bgp: P 46:113(67) ack 65 win 16365 <nop,nop,timestamp 3190136801 94785184>: BGP (NOTIFICATION: error OPEN Message Error, subcode #0) (DF)
16:34:41.651217 ExaBGPIP.38386 > OpenBGPPeerIP.bgp: F 113:113(0) ack 65 win 16384 <nop,nop,timestamp 3190136801 94785184> (DF)
16:34:41.651298 OpenBGPPeerIP.bgp > ExaBGPIP.38386: F 65:65(0) ack 113 win 17376 <nop,nop,timestamp 94785186 0> (DF) [tos 0xc0]
16:34:41.651317 ExaBGPIP.38386 > OpenBGPPeerIP.bgp: F 113:113(0) ack 66 win 16384 <nop,nop,timestamp 3190136801 94785186> (DF)
16:34:41.651418 OpenBGPPeerIP.bgp > ExaBGPIP.38386: F 65:65(0) ack 114 win 17376 <nop,nop,timestamp 94785186 0> (DF) [tos 0xc0]
16:34:41.651430 ExaBGPIP.38386 > OpenBGPPeerIP.bgp: . ack 66 win 16384 <nop,nop,timestamp 3190136801 0> (DF)
16:34:41.651540 OpenBGPPeerIP.bgp > ExaBGPIP.38386: . ack 114 win 17376 <nop,nop,timestamp 94785186 0> (DF) [tos 0xc0]
16:34:43.670894 ExaBGPIP.19431 > OpenBGPPeerIP.bgp: S 529047581:529047581(0) win 16384 <mss 1460,nop,nop,sackOK,nop,wscale 0,nop,nop,timestamp 597536024 0> (DF)
16:34:43.671025 OpenBGPPeerIP.bgp > ExaBGPIP.19431: S 3918725717:3918725717(0) ack 529047582 win 16384 <mss 1460,nop,wscale 0,nop,nop,timestamp 1978500141 597536024> (DF)
16:34:43.671045 ExaBGPIP.19431 > OpenBGPPeerIP.bgp: . ack 1 win 16384 <nop,nop,timestamp 597536024 1978500141> (DF)
16:34:43.671128 ExaBGPIP.19431 > OpenBGPPeerIP.bgp: P 1:46(45) ack 1 win 16384 <nop,nop,timestamp 597536024 1978500141>: BGP (OPEN: Version 4, AS #41157, Holdtime 180, ID ExaBGPIP, Option length 16 ((CAP MULTI_PROTOCOL [IPv4 Unicast]) (CAP AS4 #41157))) (DF)
16:34:43.671270 OpenBGPPeerIP.bgp > ExaBGPIP.19431: F 1:1(0) ack 46 win 17376 <nop,nop,timestamp 1978500141 597536024> (DF)
16:34:43.671289 ExaBGPIP.19431 > OpenBGPPeerIP.bgp: . ack 2 win 16384 <nop,nop,timestamp 597536024 1978500141> (DF)
16:34:43.975324 ExaBGPIP.19431 > OpenBGPPeerIP.bgp: F 46:46(0) ack 2 win 16384 <nop,nop,timestamp 597536025 1978500141> (DF)
16:34:43.975456 OpenBGPPeerIP.bgp > ExaBGPIP.19431: . ack 47 win 17376 <nop,nop,timestamp 1978500142 597536025> (DF)

Merci.

Manuel

_Original issue: http://code.google.com/p/exabgp/issues/detail?id=1_
