### ISSUE TITLE
Parsing grouped bgp update

### ISSUE THREAD

**Issue by dfox-spb** [Exa-Networks/exabgp#317]
When exabgp receive grouped bgp update (2+ prefixes in one update message)  it is parsed as one prefix (in my case it is flowspec rules)

i'm using api process to export received updates
```
process r-all {
    run myscript-log;
    encoder text;
}
... 
    api {
        processes [ r-all ];
        neighbor-changes;
        receive {
            parsed;
            update;
        }
    }
```

for example:
juniper(172.16.111.1) is announcing 8 flowspec rules (and grouped them by update messages)
in out i'm seeing only 2 rules.

```
jun1# run show route advertising-protocol bgp X.X.X.X             

inetflow.0: 8 destinations, 8 routes (8 active, 0 holddown, 0 hidden)
  Prefix		  Nexthop	       MED     Lclpref    AS path
  10.200.100.1,*,proto=6/term:1                
*                         Self                                    I
  10.200.100.2,*,proto=6/term:2                
*                         Self                                    I
  10.200.100.3,*,proto=6/term:3                
*                         Self                                    I
  10.200.100.4,*,proto=6/term:4                
*                         Self                                    I
  10.200.200.1,*,proto=6/term:5                
*                         Self                                    I
  10.200.200.2,*,proto=6/term:6                
*                         Self                                    I
  10.200.200.3,*,proto=6/term:7                
*                         Self                                    I
  10.200.200.4,*,proto=6/term:8                
*                         Self                                    I
```

in log i'm seeing
```
neighbor 172.16.111.1 connected

neighbor 172.16.111.1 receive 1 header FFFFFFFFFFFFFFFFFFFFFFFFFFFFFFFF003B01 body 04FDE700B40A6F6F011E02060104000100850202800002020200020440020078020641040000FDE7

neighbor 172.16.111.1 receive 4 header FFFFFFFFFFFFFFFFFFFFFFFFFFFFFFFF001304

neighbor 172.16.111.1 up

neighbor 172.16.111.1 receive 4 header FFFFFFFFFFFFFFFFFFFFFFFFFFFFFFFF001304

neighbor 172.16.111.1 receive 2 header FFFFFFFFFFFFFFFFFFFFFFFFFFFFFFFF006002 body 000000494001010040020602010000FDE7C010088006000047742400900E002D00018500000901200AC864030381060901200AC864010381060901200AC864020381060901200AC86404038106

neighbor 172.16.111.1 receive update start
neighbor 172.16.111.1 receive update announced flow destination-ipv4 10.200.100.3/32 protocol =tcp origin igp as-path [ 64999 ] extended-community rate-limit 62500
neighbor 172.16.111.1 receive update end

neighbor 172.16.111.1 receive 2 header FFFFFFFFFFFFFFFFFFFFFFFFFFFFFFFF006002 body 000000494001010040020602010000FDE7C010088006000000000000900E002D00018500000901200AC8C8010381060901200AC8C8020381060901200AC8C8040381060901200AC8C803038106

neighbor 172.16.111.1 receive update start
neighbor 172.16.111.1 receive update announced flow destination-ipv4 10.200.200.1/32 protocol =tcp origin igp as-path [ 64999 ] extended-community rate-limit 0
neighbor 172.16.111.1 receive update end

neighbor 172.16.111.1 receive 2 header FFFFFFFFFFFFFFFFFFFFFFFFFFFFFFFF001E02 body 00000007900F0003000185

neighbor 172.16.111.1 receive update start
neighbor 172.16.111.1 receive update route eor 1/133 (ipv4 flow)
neighbor 172.16.111.1 receive update end
```

and this is on console output 

```
Tue, 18 Aug 2015 17:42:18 | INFO     | 21388  | parser        | parsing attribute origin             flag 0x40 type 0x01 len 0x01 payload 00
Tue, 18 Aug 2015 17:42:18 | INFO     | 21388  | parser        | parsing attribute as-path            flag 0x40 type 0x02 len 0x06 payload 0201 0000 FDE7
Tue, 18 Aug 2015 17:42:18 | INFO     | 21388  | parser        | parsing attribute extended-community flag 0xc0 type 0x10 len 0x08 payload 8006 0000 4774 2400
Tue, 18 Aug 2015 17:42:18 | INFO     | 21388  | parser        | parsing attribute mp-reach-nlri      flag 0x90 type 0x0e len 0x2d payload 0001 8500 0009 0120 0AC8 6403 0381 0609 0120 0AC8 6401 0381 0609 0120 0AC8 6402 0381 0609 0120 0AC8 6404 0381 06
Tue, 18 Aug 2015 17:42:18 | INFO     | 21388  | parser        | parsing family    ipv4 flow          payload 0901 200A C864 0303 8106 0901 200A C864 0103 8106 0901 200A C864 0203 8106 0901 200A C864 0403 8106
Tue, 18 Aug 2015 17:42:18 | INFO     | 21388  | parser        | no withdrawn NLRI
Tue, 18 Aug 2015 17:42:18 | INFO     | 21388  | parser        | no announced NLRI
Tue, 18 Aug 2015 17:42:18 | INFO     | 21388  | parser        | parsing attribute origin             flag 0x40 type 0x01 len 0x01 payload 00
Tue, 18 Aug 2015 17:42:18 | INFO     | 21388  | parser        | parsing attribute as-path            flag 0x40 type 0x02 len 0x06 payload 0201 0000 FDE7
Tue, 18 Aug 2015 17:42:18 | INFO     | 21388  | parser        | parsing attribute extended-community flag 0xc0 type 0x10 len 0x08 payload 8006 0000 0000 0000
Tue, 18 Aug 2015 17:42:18 | INFO     | 21388  | parser        | parsing attribute mp-reach-nlri      flag 0x90 type 0x0e len 0x2d payload 0001 8500 0009 0120 0AC8 C801 0381 0609 0120 0AC8 C802 0381 0609 0120 0AC8 C804 0381 0609 0120 0AC8 C803 0381 06
Tue, 18 Aug 2015 17:42:18 | INFO     | 21388  | parser        | parsing family    ipv4 flow          payload 0901 200A C8C8 0103 8106 0901 200A C8C8 0203 8106 0901 200A C8C8 0403 8106 0901 200A C8C8 0303 8106
Tue, 18 Aug 2015 17:42:18 | INFO     | 21388  | parser        | no withdrawn NLRI
Tue, 18 Aug 2015 17:42:18 | INFO     | 21388  | parser        | no announced NLRI
```

**Comment by dfox-spb** [comment]
+ debug +tcpdump 

debug
Tue, 18 Aug 2015 18:10:26 | DEBUG    | 21457  | timers        | peer 172.16.111.1 ASN 64999   Receive Timer 179 second(s) left
Tue, 18 Aug 2015 18:10:26 | DEBUG    | 21457  | timers        | peer 172.16.111.1 ASN 64999   Receive Timer 179 second(s) left
Tue, 18 Aug 2015 18:10:26 | DEBUG    | 21457  | wire          | session 1 outgoing 185.5.162.179 / 172.16.111.1     RECEIVED  (  47) FFFF FFFF FFFF FFFF FFFF FFFF FFFF FFFF 0013 04
Tue, 18 Aug 2015 18:10:26 | INFO     | 21457  | message       | Peer    172.16.111.1 ASN 64999   << KEEPALIVE
Tue, 18 Aug 2015 18:10:26 | DEBUG    | 21457  | timers        | peer 172.16.111.1 ASN 64999   Receive Timer 179 second(s) left
Tue, 18 Aug 2015 18:10:26 | INFO     | 21457  | network       | Connected to peer neighbor 172.16.111.1 local-ip 185.5.162.179 local-as 65000 peer-as 64999 router-id 185.5.162.179 family-allowed in-open (out)
Tue, 18 Aug 2015 18:10:26 | DEBUG    | 21457  | timers        | peer 172.16.111.1 ASN 64999   Receive Timer 179 second(s) left
Tue, 18 Aug 2015 18:10:26 | DEBUG    | 21457  | wire          | session 1 outgoing 185.5.162.179 / 172.16.111.1     RECEIVED  (  47) FFFF FFFF FFFF FFFF FFFF FFFF FFFF FFFF 0013 04
Tue, 18 Aug 2015 18:10:26 | INFO     | 21457  | message       | Peer    172.16.111.1 ASN 64999   << KEEPALIVE
Tue, 18 Aug 2015 18:10:26 | DEBUG    | 21457  | timers        | peer 172.16.111.1 ASN 64999   Receive Timer 179 second(s) left
Tue, 18 Aug 2015 18:10:26 | DEBUG    | 21457  | wire          | session 1 outgoing 185.5.162.179 / 172.16.111.1     SENDING  (  74) FFFF FFFF FFFF FFFF FFFF FFFF FFFF FFFF 001E 0200 0000 0790 0F00 0300 0185
Tue, 18 Aug 2015 18:10:26 | INFO     | 21457  | message       | Peer    172.16.111.1 ASN 64999   >> EOR ipv4 flow
Tue, 18 Aug 2015 18:10:26 | INFO     | 21457  | message       | peer 172.16.111.1 ASN 64999   >> EOR(s)
Tue, 18 Aug 2015 18:10:26 | DEBUG    | 21457  | wire          | session 1 outgoing 185.5.162.179 / 172.16.111.1     RECEIVED  (  47) FFFF FFFF FFFF FFFF FFFF FFFF FFFF FFFF 0060 02
Tue, 18 Aug 2015 18:10:26 | DEBUG    | 21457  | wire          | session 1 outgoing 185.5.162.179 / 172.16.111.1     RECEIVED  ( 192) 0000 0049 4001 0100 4002 0602 0100 00FD E7C0 1008 8006 0000 4774 2400 900E 002D 0001 8500 0009 0120 0AC8 6403 0381 0609 0120 0AC8 6401 0381 0609 0120 0AC8 6402 0381 0609 0120 0AC8 6404 0381 06
Tue, 18 Aug 2015 18:10:26 | INFO     | 21457  | message       | Peer    172.16.111.1 ASN 64999   << UPDATE
Tue, 18 Aug 2015 18:10:26 | INFO     | 21457  | parser        | parsing attribute origin             flag 0x40 type 0x01 len 0x01 payload 00
Tue, 18 Aug 2015 18:10:26 | INFO     | 21457  | parser        | parsing attribute as-path            flag 0x40 type 0x02 len 0x06 payload 0201 0000 FDE7
Tue, 18 Aug 2015 18:10:26 | INFO     | 21457  | parser        | parsing attribute extended-community flag 0xc0 type 0x10 len 0x08 payload 8006 0000 4774 2400
Tue, 18 Aug 2015 18:10:26 | INFO     | 21457  | parser        | parsing attribute mp-reach-nlri      flag 0x90 type 0x0e len 0x2d payload 0001 8500 0009 0120 0AC8 6403 0381 0609 0120 0AC8 6401 0381 0609 0120 0AC8 6402 0381 0609 0120 0AC8 6404 0381 06
Tue, 18 Aug 2015 18:10:26 | INFO     | 21457  | parser        | parsing family    ipv4 flow          payload 0901 200A C864 0303 8106 0901 200A C864 0103 8106 0901 200A C864 0203 8106 0901 200A C864 0403 8106
Tue, 18 Aug 2015 18:10:26 | INFO     | 21457  | parser        | no withdrawn NLRI
Tue, 18 Aug 2015 18:10:26 | INFO     | 21457  | parser        | no announced NLRI
Tue, 18 Aug 2015 18:10:26 | DEBUG    | 21457  | timers        | peer 172.16.111.1 ASN 64999   Receive Timer 179 second(s) left
Tue, 18 Aug 2015 18:10:26 | INFO     | 21457  | routes        | peer 172.16.111.1 ASN 64999   << UPDATE (1) (  76)  attributes origin igp as-path [ 64999 ] extended-community rate-limit 62500
Tue, 18 Aug 2015 18:10:26 | INFO     | 21457  | routes        | peer 172.16.111.1 ASN 64999   << UPDATE (1) nlri  (  51) flow destination-ipv4 10.200.100.3/32 protocol =tcp
Tue, 18 Aug 2015 18:10:26 | DEBUG    | 21457  | wire          | session 1 outgoing 185.5.162.179 / 172.16.111.1     RECEIVED  (  47) FFFF FFFF FFFF FFFF FFFF FFFF FFFF FFFF 0060 02
Tue, 18 Aug 2015 18:10:26 | DEBUG    | 21457  | wire          | session 1 outgoing 185.5.162.179 / 172.16.111.1     RECEIVED  ( 192) 0000 0049 4001 0100 4002 0602 0100 00FD E7C0 1008 8006 0000 0000 0000 900E 002D 0001 8500 0009 0120 0AC8 C801 0381 0609 0120 0AC8 C802 0381 0609 0120 0AC8 C804 0381 0609 0120 0AC8 C803 0381 06
Tue, 18 Aug 2015 18:10:26 | INFO     | 21457  | message       | Peer    172.16.111.1 ASN 64999   << UPDATE
Tue, 18 Aug 2015 18:10:26 | INFO     | 21457  | parser        | parsing attribute origin             flag 0x40 type 0x01 len 0x01 payload 00
Tue, 18 Aug 2015 18:10:26 | INFO     | 21457  | parser        | parsing attribute as-path            flag 0x40 type 0x02 len 0x06 payload 0201 0000 FDE7
Tue, 18 Aug 2015 18:10:26 | INFO     | 21457  | parser        | parsing attribute extended-community flag 0xc0 type 0x10 len 0x08 payload 8006 0000 0000 0000
Tue, 18 Aug 2015 18:10:26 | INFO     | 21457  | parser        | parsing attribute mp-reach-nlri      flag 0x90 type 0x0e len 0x2d payload 0001 8500 0009 0120 0AC8 C801 0381 0609 0120 0AC8 C802 0381 0609 0120 0AC8 C804 0381 0609 0120 0AC8 C803 0381 06
Tue, 18 Aug 2015 18:10:26 | INFO     | 21457  | parser        | parsing family    ipv4 flow          payload 0901 200A C8C8 0103 8106 0901 200A C8C8 0203 8106 0901 200A C8C8 0403 8106 0901 200A C8C8 0303 8106
Tue, 18 Aug 2015 18:10:26 | INFO     | 21457  | parser        | no withdrawn NLRI
Tue, 18 Aug 2015 18:10:26 | INFO     | 21457  | parser        | no announced NLRI
Tue, 18 Aug 2015 18:10:26 | DEBUG    | 21457  | timers        | peer 172.16.111.1 ASN 64999   Receive Timer 179 second(s) left
Tue, 18 Aug 2015 18:10:26 | INFO     | 21457  | routes        | peer 172.16.111.1 ASN 64999   << UPDATE (2) (  72)  attributes origin igp as-path [ 64999 ] extended-community rate-limit 0
Tue, 18 Aug 2015 18:10:26 | INFO     | 21457  | routes        | peer 172.16.111.1 ASN 64999   << UPDATE (2) nlri  (  51) flow destination-ipv4 10.200.200.1/32 protocol =tcp
Tue, 18 Aug 2015 18:10:26 | DEBUG    | 21457  | wire          | session 1 outgoing 185.5.162.179 / 172.16.111.1     RECEIVED  (  47) FFFF FFFF FFFF FFFF FFFF FFFF FFFF FFFF 001E 02
Tue, 18 Aug 2015 18:10:26 | DEBUG    | 21457  | wire          | session 1 outgoing 185.5.162.179 / 172.16.111.1     RECEIVED  (  27) 0000 0007 900F 0003 0001 85
Tue, 18 Aug 2015 18:10:26 | INFO     | 21457  | message       | Peer    172.16.111.1 ASN 64999   << UPDATE
Tue, 18 Aug 2015 18:10:26 | DEBUG    | 21457  | timers        | peer 172.16.111.1 ASN 64999   Receive Timer 179 second(s) left
Tue, 18 Aug 2015 18:10:26 | INFO     | 21457  | routes        | peer 172.16.111.1 ASN 64999   << UPDATE (3) (   0) 
Tue, 18 Aug 2015 18:10:26 | INFO     | 21457  | routes        | peer 172.16.111.1 ASN 64999   << UPDATE (3) nlri  (  21) eor 1/133 (ipv4 flow)
Tue, 18 Aug 2015 18:10:26 | DEBUG    | 21457  | timers        | peer 172.16.111.1 ASN 64999   Receive Timer 179 second(s) left
Tue, 18 Aug 2015 18:10:27 | DEBUG    | 21457  | timers        | peer 172.16.111.1 ASN 64999   Receive Timer 179 second(s) left



tcpdump 
18:12:16.381048 Out IP (tos 0xc0, ttl  10, id 55974, offset 0, flags [none], proto: TCP (6), length: 71) 172.16.111.1.bgp > 185.5.162.179.30137: P 60:79(19) ack 87 win 16365 <nop,nop,timestamp 71166570 545606482>: BGP, length: 19
	Keepalive Message (4), length: 19
18:12:16.497056  In IP (tos 0x0, ttl  62, id 17381, offset 0, flags [DF], proto: TCP (6), length: 52) 185.5.162.179.30137 > 172.16.111.1.bgp: . ack 79 win 1040 <nop,nop,timestamp 545606596 71166570>
18:12:16.497084 Out IP (tos 0xc0, ttl  10, id 55975, offset 0, flags [none], proto: TCP (6), length: 293) 172.16.111.1.bgp > 185.5.162.179.30137: P 79:320(241) ack 87 win 16384 <nop,nop,timestamp 71166582 545606596>: BGP, length: 241
	Keepalive Message (4), length: 19
	Update Message (2), length: 96
	  Origin (1), length: 1, Flags [T]: IGP
	  AS Path (2), length: 6, Flags [T]: 64999 
	  Extended Community (16), length: 8, Flags [OT]: 
	    unknown extd community typecode (0x8006), Flags [vendor-specific]
	      0x0000: 8006 0000 4774 2400 
	  Multi-Protocol Reach NLRI (14), length: 45, Flags [OE]: 
	    AFI: IPv4 (1), vendor specific SAFI: Unknown SAFI (133)
	    no AFI 1 / SAFI 133 decoder
	    0x0000: 0001 8500 0009 0120 0ac8 6403 0381 0609 
	    0x000f: 0120 0ac8 6401 0381 0609 0120 0ac8 6402 
	    0x001f: 0381 0609 0120 0ac8 6404 0381 06
	Update Message (2), length: 96
	  Origin (1), length: 1, Flags [T]: IGP
	  AS Path (2), length: 6, Flags [T]: 64999 
	  Extended Community (16), length: 8, Flags [OT]: 
	    unknown extd community typecode (0x8006), Flags [vendor-specific]
	      0x0000: 8006 0000 0000 0000 
	  Multi-Protocol Reach NLRI (14), length: 45, Flags [OE]: 
	    AFI: IPv4 (1), vendor specific SAFI: Unknown SAFI (133)
	    no AFI 1 / SAFI 133 decoder
	    0x0000: 0001 8500 0009 0120 0ac8 c801 0381 0609 
	    0x000f: 0120 0ac8 c802 0381 0609 0120 0ac8 c804 
	    0x001f: 0381 0609 0120 0ac8 c803 0381 06
	Update Message (2), length: 30
	  Multi-Protocol Unreach NLRI (15), length: 3, Flags [OE]: 
	    AFI: IPv4 (1), vendor specific SAFI: Unknown SAFI (133)
	      End-of-Rib Marker (empty NLRI)
18:12:16.507496  In IP (tos 0x0, ttl  62, id 17388, offset 0, flags [DF], proto: TCP (6), length: 82) 185.5.162.179.30137 > 172.16.111.1.bgp: P 87:117(30) ack 320 win 1037 <nop,nop,timestamp 545606607 71166582>: BGP, length: 30
	Update Message (2), length: 30
	  Multi-Protocol Unreach NLRI (15), length: 3, Flags [OE]: 
	    AFI: IPv4 (1), vendor specific SAFI: Unknown SAFI (133)
	      End-of-Rib Marker (empty NLRI)

**Comment by dfox-spb** [comment]
Until this bug is only in the case ipv4 flowspec AF updates. 
When I`m receive many simple ipv4 AF prefixes in one update  they parsed good.

one more question: 
I am want use only "ipv4 flow"/"ipv6 flow" AF  and configuring neighbors as 
family {
 ipv4 flow;
}
but if neighbor sent me ipv4 updates (FullView for example) it is parsed and sent to my script. Can I`m limit this and receive only configured address family? 

and one more:
is it possible to configure max-prefix limit in AF on neighbor?

Sorry If this is a bad place for questions.

**Comment by thomas-mangin** [comment]
Can you please re-open a second issue for this and I will delete your comment above and this one.

**Comment by dfox-spb** [comment]
I open new issue from my comment

**Comment by thomas-mangin** [comment]
Sorry but you will have to speak with Juniper, the packet received are well what I am decoding.
Two updates are received each receiving one flow route.

**Comment by dfox-spb** [comment]
Hmm... as i see update packet with 1 rule is less than update packet with 4 rules
in 2 update messages 2x4 flow routes

**Comment by thomas-mangin** [comment]
I need more time to check what it could be .. I will try to come back to you asap.

**Comment by dfox-spb** [comment]
Hmm... as i see update packet with 1 rule is less than update packet with 4 rules
in 2 update messages was 2x4 flow routes

okey, for example i`m created 1 flowspec rule with rate-limit 333k, 4 flowspec rules with rate-limit 500k, and 9 flowspec rules with discard
Juniper are grouped this in 3 update message (1,4,9) because they have different extcommunity attributes:

on exabgp i`m see only 3 rule:
Wed, 19 Aug 2015 15:51:25 | INFO     | 25004  | network       | Connected to peer neighbor 172.16.111.1 local-ip 185.5.162.179 local-as 65000 peer-as 64999 router-id 185.5.162.179 family-allowed in-open (out)
Wed, 19 Aug 2015 15:51:25 | INFO     | 25004  | parser        | parsing attribute origin             flag 0x40 type 0x01 len 0x01 payload 00
Wed, 19 Aug 2015 15:51:25 | INFO     | 25004  | parser        | parsing attribute as-path            flag 0x40 type 0x02 len 0x06 payload 0201 0000 FDE7
Wed, 19 Aug 2015 15:51:25 | INFO     | 25004  | parser        | parsing attribute extended-community flag 0xc0 type 0x10 len 0x08 payload 8006 0000 4722 9900
Wed, 19 Aug 2015 15:51:25 | INFO     | 25004  | parser        | parsing attribute mp-reach-nlri      flag 0x90 type 0x0e len 0x15 payload 0001 8500 000F 0120 0203 0405 0381 1105 03C8 D50D 05
Wed, 19 Aug 2015 15:51:25 | INFO     | 25004  | parser        | parsing family    ipv4 flow          payload 0F01 2002 0304 0503 8111 0503 C8D5 0D05
Wed, 19 Aug 2015 15:51:25 | INFO     | 25004  | parser        | no withdrawn NLRI
Wed, 19 Aug 2015 15:51:25 | INFO     | 25004  | parser        | no announced NLRI
Wed, 19 Aug 2015 15:51:25 | INFO     | 25004  | parser        | parsing attribute origin             flag 0x40 type 0x01 len 0x01 payload 00
Wed, 19 Aug 2015 15:51:25 | INFO     | 25004  | parser        | parsing attribute as-path            flag 0x40 type 0x02 len 0x06 payload 0201 0000 FDE7
Wed, 19 Aug 2015 15:51:25 | INFO     | 25004  | parser        | parsing attribute extended-community flag 0xc0 type 0x10 len 0x08 payload 8006 0000 4774 2400
Wed, 19 Aug 2015 15:51:25 | INFO     | 25004  | parser        | parsing attribute mp-reach-nlri      flag 0x90 type 0x0e len 0x2d payload 0001 8500 0009 0120 0AC8 6401 0381 0609 0120 0AC8 6402 0381 0609 0120 0AC8 6403 0381 0609 0120 0AC8 6404 0381 06
Wed, 19 Aug 2015 15:51:25 | INFO     | 25004  | parser        | parsing family    ipv4 flow          payload 0901 200A C864 0103 8106 0901 200A C864 0203 8106 0901 200A C864 0303 8106 0901 200A C864 0403 8106
Wed, 19 Aug 2015 15:51:25 | INFO     | 25004  | parser        | no withdrawn NLRI
Wed, 19 Aug 2015 15:51:25 | INFO     | 25004  | parser        | no announced NLRI
Wed, 19 Aug 2015 15:51:25 | INFO     | 25004  | parser        | parsing attribute origin             flag 0x40 type 0x01 len 0x01 payload 00
Wed, 19 Aug 2015 15:51:25 | INFO     | 25004  | parser        | parsing attribute as-path            flag 0x40 type 0x02 len 0x06 payload 0201 0000 FDE7
Wed, 19 Aug 2015 15:51:25 | INFO     | 25004  | parser        | parsing attribute extended-community flag 0xc0 type 0x10 len 0x08 payload 8006 0000 0000 0000
Wed, 19 Aug 2015 15:51:25 | INFO     | 25004  | parser        | parsing attribute mp-reach-nlri      flag 0x90 type 0x0e len 0x5f payload 0001 8500 0009 0120 0AC8 C805 0381 0609 0120 0AC8 C806 0381 0609 0120 0AC8 C807 0381 0609 0120 0AC8 C808 0381 0609 0120 0AC8 C809 0381 0609 0120 0AC8 C801 0381 0609 0120 0AC8 C802 0381 0609 0120 0AC8 C803 0381 0609 0120 0AC8 C804 0381 06
Wed, 19 Aug 2015 15:51:25 | INFO     | 25004  | parser        | parsing family    ipv4 flow          payload 0901 200A C8C8 0503 8106 0901 200A C8C8 0603 8106 0901 200A C8C8 0703 8106 0901 200A C8C8 0803 8106 0901 200A C8C8 0903 8106 0901 200A C8C8 0103 8106 0901 200A C8C8 0203 8106 0901 200A C8C8 0303 8106 0901 200A C8C8 0403 8106
Wed, 19 Aug 2015 15:51:25 | INFO     | 25004  | parser        | no withdrawn NLRI
Wed, 19 Aug 2015 15:51:25 | INFO     | 25004  | parser        | no announced NLRI


tcpdump:
15:54:02.262407 Out IP (tos 0xc0, ttl  10, id 60928, offset 0, flags [none], proto: TCP (6), length: 415) 172.16.111.1.179 > 185.5.162.179.63631: P 79:442(363) ack 99 win 16384 <nop,nop,timestamp 78977184 623711153>: BGP, length: 363
	Keepalive Message (4), length: 19
	Update Message (2), length: 72
	  Origin (1), length: 1, Flags [T]: IGP
	  AS Path (2), length: 6, Flags [T]: 64999 
	  Extended Community (16), length: 8, Flags [OT]: 
	    unknown extd community typecode (0x8006), Flags [vendor-specific]
	      0x0000: 8006 0000 4722 9900 
	  Multi-Protocol Reach NLRI (14), length: 21, Flags [OE]: 
	    AFI: IPv4 (1), vendor specific SAFI: Unknown SAFI (133)
	    no AFI 1 / SAFI 133 decoder
	    0x0000: 0001 8500 000f 0120 0203 0405 0381 1105 
	    0x000f: 03c8 d50d 05
	Update Message (2), length: 96
	  Origin (1), length: 1, Flags [T]: IGP
	  AS Path (2), length: 6, Flags [T]: 64999 
	  Extended Community (16), length: 8, Flags [OT]: 
	    unknown extd community typecode (0x8006), Flags [vendor-specific]
	      0x0000: 8006 0000 4774 2400 
	  Multi-Protocol Reach NLRI (14), length: 45, Flags [OE]:

**Comment by thomas-mangin** [comment]
Hopefully this issue is now fixed. Thank you for reporting it and sorry for missing what it was at first.

**Comment by dfox-spb** [comment]
Now seems good... all rules parsed correctly
Thanks! ipv6 tests be soon :)

**Comment by thomas-mangin** [comment]
:+1:
